{
  "schemaVersion": 1,
  "name": "fixture-executor",
  "family": "execution",
  "artifact": "sha256:cb5bc1a47455d5932d3735707ecf5b7bf6dd69f29334cc8bafc22a4fa9f566e7",
  "protocol": {
    "major": 1,
    "minor": 0
  },
  "permissions": [
    "execute-declared-tools"
  ],
  "capabilities": [
    {
      "name": "filesystem.declared-only",
      "status": "unavailable",
      "evidenceReference": ""
    }
  ]
}
